{
  "missionId": "urn:missionweave:mission:one",
  "groupId": "urn:missionweave:group:mission-one",
  "revision": 6,
  "objective": "Implement and verify the requested API feature.",
  "definitionOfDone": [
    {
      "criterionId": "tests-pass",
      "description": "All specified integration tests pass.",
      "evidenceRequired": ["deterministic_test"]
    }
  ],
  "missionOwner": {"type": "human", "id": "urn:missionweave:human:mission-owner"},
  "coordinator": {
    "agentId": "urn:missionweave:agent:coordinator",
    "agentCardVersion": 2,
    "coordinatorEpoch": 4,
    "leaseId": "urn:missionweave:lease:coordinator-four"
  },
  "state": "active",
  "budget": {
    "currency": "USD",
    "financialLimit": 100,
    "modelTokenLimit": 100000,
    "wallClockSecondsLimit": 86400
  },
  "deadline": "2026-07-20T00:00:00Z",
  "approvalPolicy": {
    "finalHumanApproval": true,
    "highRiskExecutionApproval": true,
    "policyVersion": "1.2.0"
  },
  "createdAt": "2026-07-15T00:00:00Z"
}
